{
  "$schema": "https://raw.githubusercontent.com/penrose/penrose/main/packages/core/src/types/trio-schema.json",
  "name": "Continuous Map / Continuous Map / Functions",
  "variation": "",
  "substance": {
    "name": "Continuous Map",
    "path": "continuousmap.sub"
  },
  "style": {
    "name": "Continuous Map",
    "path": "continuousmap.sty"
  },
  "domain": {
    "name": "Functions",
    "path": "functions.dsl"
  }
}