{
  "$schema": "https://raw.githubusercontent.com/penrose/penrose/main/packages/core/src/types/trio-schema.json",
  "name": "Tree / Venn 3D / Set Theory",
  "variation": "",
  "substance": {
    "name": "Tree",
    "path": "tree.sub"
  },
  "style": {
    "name": "Venn 3D",
    "path": "venn-3d.sty"
  },
  "domain": {
    "name": "Set Theory",
    "path": "setTheory.dsl"
  }
}