{
  "$schema": "https://raw.githubusercontent.com/penrose/penrose/main/packages/core/src/types/trio-schema.json",
  "name": "Small graph / Disjoint rectangles in a large box / Graph Theory",
  "variation": "",
  "substance": {
    "name": "Small graph",
    "path": "small-graph.sub"
  },
  "style": {
    "name": "Disjoint rectangles in a large box",
    "path": "disjoint-rects-large-canvas.sty"
  },
  "domain": {
    "name": "Graph Theory",
    "path": "graph-theory.dsl"
  }
}