{
  "$schema": "https://raw.githubusercontent.com/penrose/penrose/main/packages/core/src/types/trio-schema.json",
  "name": "SIGGRAPH teaser / Euclidean - SIGGRAPH teaser / Geometry",
  "variation": "StromboliCat61816",
  "substance": {
    "name": "SIGGRAPH teaser",
    "path": "teaser.sub"
  },
  "style": {
    "name": "Euclidean - SIGGRAPH teaser",
    "path": "euclidean-teaser.sty"
  },
  "domain": {
    "name": "Geometry",
    "path": "geometry.dsl"
  }
}