{
  "$schema": "https://raw.githubusercontent.com/penrose/penrose/main/packages/core/src/types/trio-schema.json",
  "name": "WoS Laplace Estimator / Walk on Spheres / Walk on Spheres",
  "variation": "TideHawk3699",
  "substance": {
    "name": "WoS Laplace Estimator",
    "path": "Poisson.sub"
  },
  "style": {
    "name": "Walk on Spheres",
    "path": "walk-on-spheres.sty"
  },
  "domain": {
    "name": "Walk on Spheres",
    "path": "walk-on-spheres.dsl"
  }
}